{
  "$schema": "https://auralislab.dev/schema/icon-associations-v1.json",
  "schemaVersion": 1,
  "family": "balanced",
  "fileExtensions": {
    "ts": "_ts",
    "tsx": "_tsx",
    "js": "_js",
    "jsx": "_jsx",
    "mjs": "_js",
    "cjs": "_js",
    "rs": "_rs",
    "go": "_go",
    "py": "_py",
    "json": "_json",
    "jsonc": "_json",
    "md": "_md",
    "mdx": "_md",
    "css": "_css",
    "scss": "_css",
    "less": "_css",
    "html": "_html",
    "yml": "_yml",
    "yaml": "_yaml",
    "toml": "_toml",
    "tf": "_tf",
    "tfvars": "_tf",
    "hcl": "_hcl",
    "sh": "_sh",
    "bash": "_sh",
    "zsh": "_sh",
    "env": "_env",
    "lock": "_lock",
    "sql": "_sql",
    "svg": "_svg",
    "png": "_image",
    "jpg": "_image",
    "jpeg": "_image",
    "webp": "_image",
    "gif": "_image",
    "astro": "_astro",
    "svelte": "_svelte",
    "vue": "_vue",
    "graphql": "_graphql",
    "gql": "_graphql",
    "prisma": "_prisma",
    "java": "_java",
    "c": "_c",
    "h": "_c",
    "cpp": "_cpp",
    "cc": "_cpp",
    "cxx": "_cpp",
    "hpp": "_cpp",
    "cs": "_cs",
    "php": "_php",
    "rb": "_rb",
    "swift": "_swift",
    "kt": "_kt",
    "kts": "_kt",
    "dart": "_dart",
    "lua": "_lua",
    "r": "_r",
    "csv": "_csv",
    "tsv": "_csv",
    "xml": "_xml",
    "pdf": "_pdf",
    "lockb": "_lock",
    "pem": "_secret",
    "crt": "_secret",
    "cer": "_secret",
    "key": "_secret",
    "pub": "_secret",
    "kubeconfig": "_k8s",
    "mts": "_ts",
    "cts": "_ts",
    "ex": "_ex",
    "exs": "_ex",
    "heex": "_ex",
    "erl": "_erlang",
    "hrl": "_erlang",
    "clj": "_clj",
    "cljs": "_clj",
    "cljc": "_clj",
    "edn": "_clj",
    "scala": "_scala",
    "sbt": "_scala",
    "hs": "_hs",
    "lhs": "_hs",
    "ml": "_ocaml",
    "mli": "_ocaml",
    "nim": "_nim",
    "zig": "_zig",
    "jl": "_jl",
    "pl": "_perl",
    "pm": "_perl",
    "ps1": "_ps1",
    "psm1": "_ps1",
    "psd1": "_ps1",
    "bat": "_bat",
    "cmd": "_bat",
    "fs": "_fsharp",
    "fsi": "_fsharp",
    "fsx": "_fsharp",
    "groovy": "_groovy",
    "gradle": "_gradle",
    "m": "_objc",
    "mm": "_objc",
    "proto": "_proto",
    "sol": "_sol",
    "ipynb": "_notebook",
    "txt": "_text",
    "rst": "_text",
    "adoc": "_text",
    "tex": "_text",
    "log": "_log",
    "ini": "_ini",
    "cfg": "_ini",
    "conf": "_ini",
    "properties": "_ini",
    "editorconfig": "_ini",
    "woff": "_font",
    "woff2": "_font",
    "ttf": "_font",
    "otf": "_font",
    "eot": "_font",
    "mp3": "_audio",
    "wav": "_audio",
    "ogg": "_audio",
    "flac": "_audio",
    "m4a": "_audio",
    "mp4": "_video",
    "mov": "_video",
    "avi": "_video",
    "mkv": "_video",
    "webm": "_video",
    "zip": "_archive",
    "tar": "_archive",
    "gz": "_archive",
    "tgz": "_archive",
    "bz2": "_archive",
    "xz": "_archive",
    "rar": "_archive",
    "7z": "_archive",
    "ico": "_image",
    "bmp": "_image",
    "avif": "_image",
    "tiff": "_image",
    "wasm": "_wasm",
    "nix": "_nix",
    "db": "_sql",
    "sqlite": "_sql",
    "sqlite3": "_sql",
    "patch": "_git",
    "diff": "_git",
    "hbs": "_tmpl",
    "ejs": "_tmpl",
    "pug": "_tmpl",
    "njk": "_tmpl",
    "mustache": "_tmpl",
    "liquid": "_tmpl",
    "styl": "_css",
    "htm": "_html",
    "xhtml": "_html",
    "plist": "_xml",
    "xsl": "_xml",
    "dockerfile": "_docker",
    "containerfile": "_docker",
    "d.ts": "_dts",
    "d.mts": "_dts",
    "d.cts": "_dts",
    "test.ts": "_jest",
    "test.tsx": "_jest",
    "test.js": "_jest",
    "test.jsx": "_jest",
    "spec.ts": "_jest",
    "spec.tsx": "_jest",
    "spec.js": "_jest",
    "spec.jsx": "_jest",
    "stories.ts": "_storybook",
    "stories.tsx": "_storybook",
    "stories.js": "_storybook",
    "stories.jsx": "_storybook",
    "stories.mdx": "_storybook",
    "cy.ts": "_cypress",
    "cy.js": "_cypress",
    "snap": "_jest",
    "sass": "_css",
    "erb": "_rb",
    "slim": "_rb",
    "haml": "_rb",
    "csproj": "_dotnet",
    "fsproj": "_dotnet",
    "vbproj": "_dotnet",
    "sln": "_dotnet",
    "razor": "_dotnet",
    "cshtml": "_dotnet",
    "bicep": "_bicep",
    "bicepparam": "_bicep",
    "jsonnet": "_jsonnet",
    "libsonnet": "_jsonnet",
    "cue": "_cue",
    "rego": "_policy",
    "nomad": "_nomad",
    "vy": "_sol",
    "cairo": "_sol",
    "tfstate": "_tf",
    "tfstate.backup": "_tf",
    "tftpl": "_tf",
    "mdc": "_md",
    "vtt": "_video",
    "srt": "_video",
    "heic": "_image",
    "jxl": "_image",
    "dmg": "_archive",
    "deb": "_archive",
    "rpm": "_archive",
    "apk": "_archive",
    "jar": "_java",
    "war": "_java",
    "class": "_java",
    "dll": "_dotnet",
    "pdb": "_dotnet",
    "vsix": "_archive",
    "parquet": "_csv",
    "avro": "_csv",
    "orc": "_csv",
    "ndjson": "_json",
    "jsonl": "_json",
    "json5": "_json",
    "map": "_json",
    "tsbuildinfo": "_json",
    "wat": "_wasm"
  },
  "fileNames": {
    ".gitignore": "_git",
    ".gitattributes": "_git",
    ".gitlab-ci.yml": "_gitlab",
    ".gitlab-ci.yaml": "_gitlab",
    ".env": "_env",
    ".env.local": "_env",
    ".env.development": "_env",
    ".env.production": "_env",
    ".env.test": "_env",
    ".env.example": "_env",
    ".npmrc": "_npm",
    "package.json": "_npm",
    "bun.lock": "_lock",
    "pnpm-lock.yaml": "_lock",
    "pnpm-workspace.yaml": "_workspace",
    "package-lock.json": "_lock",
    "yarn.lock": "_lock",
    "bun.lockb": "_lock",
    "Dockerfile": "_docker",
    ".dockerignore": "_docker",
    "docker-compose.yml": "_docker",
    "docker-compose.yaml": "_docker",
    "compose.yml": "_docker",
    "compose.yaml": "_docker",
    "terraform.tfvars": "_tf",
    "terraform.tfvars.json": "_tf",
    ".terraform.lock.hcl": "_lock",
    "terragrunt.hcl": "_tf",
    "backend.tf": "_tf",
    "providers.tf": "_tf",
    "versions.tf": "_tf",
    "variables.tf": "_tf",
    "outputs.tf": "_tf",
    "main.tf": "_tf",
    "locals.tf": "_tf",
    "next.config.js": "_next",
    "next.config.mjs": "_next",
    "next.config.ts": "_next",
    "next.config.mts": "_next",
    "remix.config.js": "_remix",
    "vite.config.js": "_vite",
    "vite.config.mjs": "_vite",
    "vite.config.ts": "_vite",
    "vitest.config.ts": "_vite",
    "tsconfig.json": "_ts",
    "tsconfig.base.json": "_ts",
    "jsconfig.json": "_js",
    "tailwind.config.js": "_tailwind",
    "tailwind.config.ts": "_tailwind",
    "tailwind.config.mjs": "_tailwind",
    "postcss.config.js": "_css",
    "eslint.config.js": "_eslint",
    "eslint.config.mjs": "_eslint",
    "eslint.config.ts": "_eslint",
    ".eslintrc": "_eslint",
    ".eslintrc.json": "_eslint",
    ".prettierrc": "_prettier",
    ".prettierrc.json": "_prettier",
    "prettier.config.js": "_prettier",
    "prettier.config.mjs": "_prettier",
    "webpack.config.js": "_webpack",
    "rollup.config.js": "_rollup",
    "turbo.json": "_turbo",
    "nx.json": "_nx",
    "lerna.json": "_workspace",
    "vercel.json": "_vercel",
    "netlify.toml": "_netlify",
    "supabase.toml": "_supabase",
    "schema.prisma": "_prisma",
    "Chart.yaml": "_helm",
    "Chart.lock": "_helm",
    "values.yaml": "_helm",
    "helmfile.yaml": "_helm",
    "helmfile.yml": "_helm",
    "kustomization.yaml": "_k8s",
    "kustomization.yml": "_k8s",
    "skaffold.yaml": "_k8s",
    "skaffold.yml": "_k8s",
    "Pulumi.yaml": "_pulumi",
    "Pulumi.yml": "_pulumi",
    "Pulumi.dev.yaml": "_pulumi",
    "Pulumi.prod.yaml": "_pulumi",
    "ansible.cfg": "_ansible",
    "playbook.yml": "_ansible",
    "playbook.yaml": "_ansible",
    "action.yml": "_actions",
    "action.yaml": "_actions",
    "azure-pipelines.yml": "_azure",
    "azure-pipelines.yaml": "_azure",
    "cloudbuild.yaml": "_gcp",
    "cloudbuild.yml": "_gcp",
    "serverless.yml": "_serverless",
    "serverless.yaml": "_serverless",
    "samconfig.toml": "_sam",
    "Jenkinsfile": "_jenkins",
    "Makefile": "_make",
    "makefile": "_make",
    "Taskfile.yml": "_task",
    "Taskfile.yaml": "_task",
    "justfile": "_just",
    "Justfile": "_just",
    "go.mod": "_gomod",
    "go.sum": "_gomod",
    "go.work": "_gomod",
    "Cargo.toml": "_cargo",
    "Cargo.lock": "_cargo",
    "pyproject.toml": "_python",
    "requirements.txt": "_python",
    "requirements-dev.txt": "_python",
    "poetry.lock": "_lock",
    "Pipfile": "_python",
    "Pipfile.lock": "_lock",
    "uv.lock": "_lock",
    ".snyk": "_snyk",
    "trivy.yaml": "_trivy",
    "trivy.yml": "_trivy",
    ".trivyignore": "_trivy",
    "semgrep.yml": "_semgrep",
    "semgrep.yaml": "_semgrep",
    ".semgrepignore": "_semgrep",
    "policy.rego": "_policy",
    "CODEOWNERS": "_codeowners",
    "SECURITY.md": "_security",
    "secrets.yaml": "_secret",
    "secrets.yml": "_secret",
    ".changeset": "_changeset",
    ".releaserc": "_changeset",
    "README.md": "_md",
    "LICENSE": "_license",
    "CMakeLists.txt": "_make",
    "Gemfile": "_rb",
    "Gemfile.lock": "_lock",
    "Rakefile": "_rb",
    "Vagrantfile": "_rb",
    "build.gradle": "_gradle",
    "build.gradle.kts": "_gradle",
    "settings.gradle": "_gradle",
    "settings.gradle.kts": "_gradle",
    "gradle.properties": "_gradle",
    "pom.xml": "_java",
    "composer.json": "_composer",
    "composer.lock": "_lock",
    "mix.exs": "_ex",
    "mix.lock": "_lock",
    "flake.nix": "_nix",
    "flake.lock": "_lock",
    "default.nix": "_nix",
    "shell.nix": "_nix",
    ".editorconfig": "_ini",
    ".nvmrc": "_npm",
    ".node-version": "_npm",
    ".yarnrc": "_npm",
    ".yarnrc.yml": "_npm",
    ".python-version": "_python",
    ".ruby-version": "_rb",
    ".tool-versions": "_ini",
    "setup.py": "_python",
    "setup.cfg": "_python",
    "tox.ini": "_python",
    "manage.py": "_python",
    "requirements.in": "_python",
    "deno.json": "_json",
    "deno.jsonc": "_json",
    "biome.json": "_json",
    "renovate.json": "_json",
    ".browserslistrc": "_ini",